etudecas/simulation/sensibility/active_supplier_parameter_result_upstream_constrained/supplier_parameter_threshold_summary.csv

acceptable_levels,baseline_fill_rate,baseline_total_cost,cost_warning_level,ending_backlog_cross_threshold_at,ending_backlog_monotonicity,fill_rate_cross_service_threshold_at,fill_rate_max,fill_rate_min,fill_rate_monotonicity,first_unacceptable_level,levels,max_external_procured_qty_delta,max_fill_rate_drop,max_total_cost_increase,parameter_group,parameter_key,parameter_label,safe_band_high,safe_band_low,safe_direction,total_cost_cross_threshold_at,total_cost_monotonicity
"[0.01, 0.1, 0.25, 0.5, 0.75, 1.0]",1.0,61148958.3234,,,flat,0.05,1.0,1.0,flat,0.05,"[0.01, 0.05, 0.1, 0.25, 0.5, 0.75, 1.0]",1413464.2426999807,0.0,17665.28860000521,supplier_capacity_node,supplier_capacity_node::SDC-VD0520115A,Capacite fournisseur SDC-VD0520115A,1.0,0.01,lower_is_riskier,,non_monotonic
"[0.01, 0.1, 0.25, 0.5, 0.75, 1.0]",1.0,61148958.3234,,,flat,0.05,1.0,1.0,flat,0.05,"[0.01, 0.05, 0.1, 0.25, 0.5, 0.75, 1.0]",1187823.2022000551,0.0,53264.84650000185,supplier_capacity_node,supplier_capacity_node::SDC-VD1095770A,Capacite fournisseur SDC-VD1095770A,1.0,0.01,lower_is_riskier,,non_monotonic
"[0.01, 0.1, 0.25, 0.5, 0.75, 1.0]",1.0,61148958.3234,,,flat,0.05,1.0,1.0,flat,0.05,"[0.01, 0.05, 0.1, 0.25, 0.5, 0.75, 1.0]",4024399.2639000416,0.0,164041.24020000547,supplier_capacity_global,supplier_capacity_scale,Capacite fournisseur globale,1.0,0.01,lower_is_riskier,,non_monotonic
[1.0],1.0,61148958.3234,,0.01,decreasing,0.01,1.0,0.502754,increasing,0.01,"[0.01, 1.0]",0.0,0.49724599999999997,0.0,external_market,external_procurement_enabled,External market active,1.0,1.0,lower_is_riskier,,increasing
"[0.1, 0.25, 0.5, 0.75, 1.0]",1.0,61148958.3234,,,flat,0.01,1.0,1.0,flat,0.01,"[0.01, 0.05, 0.1, 0.25, 0.5, 0.75, 1.0]",1187823.2022000551,0.0,60163.388400003314,supplier_capacity_node,supplier_capacity_node::SDC-VD0508918A,Capacite fournisseur SDC-VD0508918A,1.0,0.1,lower_is_riskier,,decreasing
"[0.25, 0.5, 0.75, 1.0]",1.0,61148958.3234,,,flat,0.01,1.0,1.0,flat,0.01,"[0.01, 0.05, 0.1, 0.25, 0.5, 0.75, 1.0]",4940663.913800001,0.0,155992.04510000348,supplier_capacity_node,supplier_capacity_node::SDC-VD0518684A,Capacite fournisseur SDC-VD0518684A,1.0,0.25,lower_is_riskier,,non_monotonic
"[0.05, 0.1, 0.25, 0.5, 0.75, 1.0]",1.0,61148958.3234,,,flat,0.01,1.0,1.0,flat,0.01,"[0.01, 0.05, 0.1, 0.25, 0.5, 0.75, 1.0]",19870.119099974632,0.0,0.0,supplier_capacity_node,supplier_capacity_node::SDC-VD0525412A,Capacite fournisseur SDC-VD0525412A,1.0,0.05,lower_is_riskier,,increasing
"[0.25, 0.5, 0.75, 1.0]",1.0,61148958.3234,,,flat,0.01,1.0,1.0,flat,0.01,"[0.01, 0.05, 0.1, 0.25, 0.5, 0.75, 1.0]",4407543.739600062,0.0,284450.11630000174,supplier_capacity_node,supplier_capacity_node::SDC-VD0910216A,Capacite fournisseur SDC-VD0910216A,1.0,0.25,lower_is_riskier,,decreasing
"[0.25, 0.5, 0.75, 1.0]",1.0,61148958.3234,,,flat,0.01,1.0,1.0,flat,0.01,"[0.01, 0.05, 0.1, 0.25, 0.5, 0.75, 1.0]",1288281.9223999977,0.0,165561.28840000182,supplier_capacity_node,supplier_capacity_node::SDC-VD0914320A,Capacite fournisseur SDC-VD0914320A,1.0,0.25,lower_is_riskier,,non_monotonic
"[0.1, 0.25, 0.5, 0.75, 1.0]",1.0,61148958.3234,,,flat,0.01,1.0,1.0,flat,0.01,"[0.01, 0.05, 0.1, 0.25, 0.5, 0.75, 1.0]",4340039.3301000595,0.0,101189.56270000339,supplier_capacity_node,supplier_capacity_node::SDC-VD0993480A,Capacite fournisseur SDC-VD0993480A,1.0,0.1,lower_is_riskier,,decreasing
"[0.25, 0.5, 0.75, 0.9, 1.0]",1.0,61148958.3234,0.01,,flat,0.01,1.0,1.0,flat,0.01,"[0.01, 0.25, 0.5, 0.75, 0.9, 1.0]",23261391.917400002,0.0,11997757.433900006,supplier_stock_global,supplier_stock_scale,Stock fournisseur global,1.0,0.25,lower_is_riskier,0.01,non_monotonic
"[0.25, 0.5, 0.75, 1.0]",1.0,61148958.3234,,,flat,,1.0,1.0,flat,,"[0.25, 0.5, 0.75, 1.0]",0.0,0.0,0.0,external_market,external_procurement_daily_cap_days_scale,Capacite external market,1.0,0.25,lower_is_riskier,,increasing
"[0.01, 0.05, 0.1, 0.25, 0.5, 0.75, 1.0]",1.0,61148958.3234,,,flat,,1.0,1.0,flat,,"[0.01, 0.05, 0.1, 0.25, 0.5, 0.75, 1.0]",0.0,0.0,0.0,supplier_capacity_node,supplier_capacity_node::SDC-VD0500655A,Capacite fournisseur SDC-VD0500655A,1.0,0.01,lower_is_riskier,,flat
"[0.01, 0.05, 0.1, 0.25, 0.5, 0.75, 1.0]",1.0,61148958.3234,,,flat,,1.0,1.0,flat,,"[0.01, 0.05, 0.1, 0.25, 0.5, 0.75, 1.0]",0.0,0.0,0.0,supplier_capacity_node,supplier_capacity_node::SDC-VD0505677A,Capacite fournisseur SDC-VD0505677A,1.0,0.01,lower_is_riskier,,flat
"[0.01, 0.05, 0.1, 0.25, 0.5, 0.75, 1.0]",1.0,61148958.3234,,,flat,,1.0,1.0,flat,,"[0.01, 0.05, 0.1, 0.25, 0.5, 0.75, 1.0]",0.0,0.0,0.0,supplier_capacity_node,supplier_capacity_node::SDC-VD0514881A,Capacite fournisseur SDC-VD0514881A,1.0,0.01,lower_is_riskier,,flat
"[0.01, 0.05, 0.1, 0.25, 0.5, 0.75, 1.0]",1.0,61148958.3234,,,flat,,1.0,1.0,flat,,"[0.01, 0.05, 0.1, 0.25, 0.5, 0.75, 1.0]",289.24460005760193,0.0,955.9579000025988,supplier_capacity_node,supplier_capacity_node::SDC-VD0519670A,Capacite fournisseur SDC-VD0519670A,1.0,0.01,lower_is_riskier,,non_monotonic
"[0.01, 0.05, 0.1, 0.25, 0.5, 0.75, 1.0]",1.0,61148958.3234,,,flat,,1.0,1.0,flat,,"[0.01, 0.05, 0.1, 0.25, 0.5, 0.75, 1.0]",0.0,0.0,0.0,supplier_capacity_node,supplier_capacity_node::SDC-VD0520132A,Capacite fournisseur SDC-VD0520132A,1.0,0.01,lower_is_riskier,,flat
"[0.01, 0.05, 0.1, 0.25, 0.5, 0.75, 1.0]",1.0,61148958.3234,,,flat,,1.0,1.0,flat,,"[0.01, 0.05, 0.1, 0.25, 0.5, 0.75, 1.0]",0.0,0.0,0.0,supplier_capacity_node,supplier_capacity_node::SDC-VD0901566A,Capacite fournisseur SDC-VD0901566A,1.0,0.01,lower_is_riskier,,flat
"[0.01, 0.05, 0.1, 0.25, 0.5, 0.75, 1.0]",1.0,61148958.3234,,,flat,,1.0,1.0,flat,,"[0.01, 0.05, 0.1, 0.25, 0.5, 0.75, 1.0]",0.0,0.0,0.0,supplier_capacity_node,supplier_capacity_node::SDC-VD0914360C,Capacite fournisseur SDC-VD0914360C,1.0,0.01,lower_is_riskier,,flat
"[0.01, 0.05, 0.1, 0.25, 0.5, 0.75, 1.0]",1.0,61148958.3234,,,flat,,1.0,1.0,flat,,"[0.01, 0.05, 0.1, 0.25, 0.5, 0.75, 1.0]",0.0,0.0,0.0,supplier_capacity_node,supplier_capacity_node::SDC-VD0914690A,Capacite fournisseur SDC-VD0914690A,1.0,0.01,lower_is_riskier,,flat
"[0.01, 0.05, 0.1, 0.25, 0.5, 0.75, 1.0]",1.0,61148958.3234,,,flat,,1.0,1.0,flat,,"[0.01, 0.05, 0.1, 0.25, 0.5, 0.75, 1.0]",0.0,0.0,0.0,supplier_capacity_node,supplier_capacity_node::SDC-VD0949099A,Capacite fournisseur SDC-VD0949099A,1.0,0.01,lower_is_riskier,,flat
"[0.01, 0.05, 0.1, 0.25, 0.5, 0.75, 1.0]",1.0,61148958.3234,,,flat,,1.0,1.0,flat,,"[0.01, 0.05, 0.1, 0.25, 0.5, 0.75, 1.0]",129344.35220003128,0.0,75698.05139999837,supplier_capacity_node,supplier_capacity_node::SDC-VD0951020A,Capacite fournisseur SDC-VD0951020A,1.0,0.01,lower_is_riskier,,non_monotonic
"[0.01, 0.05, 0.1, 0.25, 0.5, 0.75, 1.0]",1.0,61148958.3234,,,flat,,1.0,1.0,flat,,"[0.01, 0.05, 0.1, 0.25, 0.5, 0.75, 1.0]",94825.79369997978,0.0,55717.44849999994,supplier_capacity_node,supplier_capacity_node::SDC-VD0956464A,Capacite fournisseur SDC-VD0956464A,1.0,0.01,lower_is_riskier,,non_monotonic
"[0.01, 0.05, 0.1, 0.25, 0.5, 0.75, 1.0]",1.0,61148958.3234,,,flat,,1.0,1.0,flat,,"[0.01, 0.05, 0.1, 0.25, 0.5, 0.75, 1.0]",0.0,0.0,0.0,supplier_capacity_node,supplier_capacity_node::SDC-VD0960508A,Capacite fournisseur SDC-VD0960508A,1.0,0.01,lower_is_riskier,,flat
"[0.01, 0.05, 0.1, 0.25, 0.5, 0.75, 1.0]",1.0,61148958.3234,,,flat,,1.0,1.0,flat,,"[0.01, 0.05, 0.1, 0.25, 0.5, 0.75, 1.0]",31243.28770005703,0.0,53162.14039999992,supplier_capacity_node,supplier_capacity_node::SDC-VD0964290A,Capacite fournisseur SDC-VD0964290A,1.0,0.01,lower_is_riskier,,non_monotonic
"[0.01, 0.05, 0.1, 0.25, 0.5, 0.75, 1.0]",1.0,61148958.3234,,,flat,,1.0,1.0,flat,,"[0.01, 0.05, 0.1, 0.25, 0.5, 0.75, 1.0]",0.0,0.0,0.0,supplier_capacity_node,supplier_capacity_node::SDC-VD0972460A,Capacite fournisseur SDC-VD0972460A,1.0,0.01,lower_is_riskier,,flat
"[0.01, 0.05, 0.1, 0.25, 0.5, 0.75, 1.0]",1.0,61148958.3234,,,flat,,1.0,1.0,flat,,"[0.01, 0.05, 0.1, 0.25, 0.5, 0.75, 1.0]",0.0,0.0,0.0,supplier_capacity_node,supplier_capacity_node::SDC-VD0975221A,Capacite fournisseur SDC-VD0975221A,1.0,0.01,lower_is_riskier,,flat
"[0.01, 0.05, 0.1, 0.25, 0.5, 0.75, 1.0]",1.0,61148958.3234,,,flat,,1.0,1.0,flat,,"[0.01, 0.05, 0.1, 0.25, 0.5, 0.75, 1.0]",0.0,0.0,0.0,supplier_capacity_node,supplier_capacity_node::SDC-VD0989480A,Capacite fournisseur SDC-VD0989480A,1.0,0.01,lower_is_riskier,,flat
"[0.01, 0.05, 0.1, 0.25, 0.5, 0.75, 1.0]",1.0,61148958.3234,,,flat,,1.0,1.0,flat,,"[0.01, 0.05, 0.1, 0.25, 0.5, 0.75, 1.0]",0.0,0.0,0.0,supplier_capacity_node,supplier_capacity_node::SDC-VD0990780A,Capacite fournisseur SDC-VD0990780A,1.0,0.01,lower_is_riskier,,flat
"[0.01, 0.05, 0.1, 0.25, 0.5, 0.75, 1.0]",1.0,61148958.3234,,,flat,,1.0,1.0,flat,,"[0.01, 0.05, 0.1, 0.25, 0.5, 0.75, 1.0]",20296.060700058937,0.0,151200.8126000017,supplier_capacity_node,supplier_capacity_node::SDC-VD1091642A,Capacite fournisseur SDC-VD1091642A,1.0,0.01,lower_is_riskier,,non_monotonic
"[0.01, 0.05, 0.1, 0.25, 0.5, 0.75, 1.0]",1.0,61148958.3234,,,flat,,1.0,1.0,flat,,"[0.01, 0.05, 0.1, 0.25, 0.5, 0.75, 1.0]",0.0,0.0,0.0,supplier_capacity_node,supplier_capacity_node::SDC-VD1096202A,Capacite fournisseur SDC-VD1096202A,1.0,0.01,lower_is_riskier,,flat
"[1.0, 1.5, 2.0]",1.0,61148958.3234,,,flat,,1.0,1.0,flat,,"[1.0, 1.5, 2.0]",437062157.4965,0.0,193984.63410000503,external_market,external_procurement_lead_days_scale,Delai external market,2.0,1.0,higher_is_riskier,,non_monotonic
"[0.01, 0.25, 0.5, 0.75, 0.9, 1.0]",1.0,61148958.3234,,,flat,,1.0,1.0,flat,,"[0.01, 0.25, 0.5, 0.75, 0.9, 1.0]",0.0,0.0,0.0,supplier_stock_node,supplier_stock_node::SDC-VD0500655A,Stock fournisseur SDC-VD0500655A,1.0,0.01,lower_is_riskier,,flat
"[0.01, 0.25, 0.5, 0.75, 0.9, 1.0]",1.0,61148958.3234,,,flat,,1.0,1.0,flat,,"[0.01, 0.25, 0.5, 0.75, 0.9, 1.0]",0.0,0.0,0.0,supplier_stock_node,supplier_stock_node::SDC-VD0505677A,Stock fournisseur SDC-VD0505677A,1.0,0.01,lower_is_riskier,,flat
"[0.01, 0.25, 0.5, 0.75, 0.9, 1.0]",1.0,61148958.3234,,,flat,,1.0,1.0,flat,,"[0.01, 0.25, 0.5, 0.75, 0.9, 1.0]",0.0,0.0,0.0,supplier_stock_node,supplier_stock_node::SDC-VD0508918A,Stock fournisseur SDC-VD0508918A,1.0,0.01,lower_is_riskier,,flat
"[0.01, 0.25, 0.5, 0.75, 0.9, 1.0]",1.0,61148958.3234,,,flat,,1.0,1.0,flat,,"[0.01, 0.25, 0.5, 0.75, 0.9, 1.0]",0.0,0.0,0.0,supplier_stock_node,supplier_stock_node::SDC-VD0514881A,Stock fournisseur SDC-VD0514881A,1.0,0.01,lower_is_riskier,,flat
"[0.01, 0.25, 0.5, 0.75, 0.9, 1.0]",1.0,61148958.3234,,,flat,,1.0,1.0,flat,,"[0.01, 0.25, 0.5, 0.75, 0.9, 1.0]",0.0,0.0,0.0,supplier_stock_node,supplier_stock_node::SDC-VD0518684A,Stock fournisseur SDC-VD0518684A,1.0,0.01,lower_is_riskier,,flat
"[0.01, 0.25, 0.5, 0.75, 0.9, 1.0]",1.0,61148958.3234,,,flat,,1.0,1.0,flat,,"[0.01, 0.25, 0.5, 0.75, 0.9, 1.0]",0.0,0.0,0.0,supplier_stock_node,supplier_stock_node::SDC-VD0519670A,Stock fournisseur SDC-VD0519670A,1.0,0.01,lower_is_riskier,,flat
"[0.01, 0.25, 0.5, 0.75, 0.9, 1.0]",1.0,61148958.3234,,,flat,,1.0,1.0,flat,,"[0.01, 0.25, 0.5, 0.75, 0.9, 1.0]",0.0,0.0,0.0,supplier_stock_node,supplier_stock_node::SDC-VD0520115A,Stock fournisseur SDC-VD0520115A,1.0,0.01,lower_is_riskier,,flat
"[0.01, 0.25, 0.5, 0.75, 0.9, 1.0]",1.0,61148958.3234,,,flat,,1.0,1.0,flat,,"[0.01, 0.25, 0.5, 0.75, 0.9, 1.0]",0.0,0.0,0.0,supplier_stock_node,supplier_stock_node::SDC-VD0520132A,Stock fournisseur SDC-VD0520132A,1.0,0.01,lower_is_riskier,,flat
"[0.01, 0.25, 0.5, 0.75, 0.9, 1.0]",1.0,61148958.3234,,,flat,,1.0,1.0,flat,,"[0.01, 0.25, 0.5, 0.75, 0.9, 1.0]",0.0,0.0,0.0,supplier_stock_node,supplier_stock_node::SDC-VD0525412A,Stock fournisseur SDC-VD0525412A,1.0,0.01,lower_is_riskier,,flat
"[0.01, 0.25, 0.5, 0.75, 0.9, 1.0]",1.0,61148958.3234,,,flat,,1.0,1.0,flat,,"[0.01, 0.25, 0.5, 0.75, 0.9, 1.0]",0.0,0.0,0.0,supplier_stock_node,supplier_stock_node::SDC-VD0901566A,Stock fournisseur SDC-VD0901566A,1.0,0.01,lower_is_riskier,,flat
"[0.01, 0.25, 0.5, 0.75, 0.9, 1.0]",1.0,61148958.3234,,,flat,,1.0,1.0,flat,,"[0.01, 0.25, 0.5, 0.75, 0.9, 1.0]",0.0,0.0,0.0,supplier_stock_node,supplier_stock_node::SDC-VD0910216A,Stock fournisseur SDC-VD0910216A,1.0,0.01,lower_is_riskier,,flat
"[0.01, 0.25, 0.5, 0.75, 0.9, 1.0]",1.0,61148958.3234,,,flat,,1.0,1.0,flat,,"[0.01, 0.25, 0.5, 0.75, 0.9, 1.0]",6.304499983787537,0.0,195.62359999865294,supplier_stock_node,supplier_stock_node::SDC-VD0914320A,Stock fournisseur SDC-VD0914320A,1.0,0.01,lower_is_riskier,,decreasing
"[0.01, 0.25, 0.5, 0.75, 0.9, 1.0]",1.0,61148958.3234,,,flat,,1.0,1.0,flat,,"[0.01, 0.25, 0.5, 0.75, 0.9, 1.0]",0.0,0.0,0.0,supplier_stock_node,supplier_stock_node::SDC-VD0914360C,Stock fournisseur SDC-VD0914360C,1.0,0.01,lower_is_riskier,,flat
"[0.01, 0.25, 0.5, 0.75, 0.9, 1.0]",1.0,61148958.3234,,,flat,,1.0,1.0,flat,,"[0.01, 0.25, 0.5, 0.75, 0.9, 1.0]",0.0,0.0,0.0,supplier_stock_node,supplier_stock_node::SDC-VD0914690A,Stock fournisseur SDC-VD0914690A,1.0,0.01,lower_is_riskier,,flat
"[0.01, 0.25, 0.5, 0.75, 0.9, 1.0]",1.0,61148958.3234,,,flat,,1.0,1.0,flat,,"[0.01, 0.25, 0.5, 0.75, 0.9, 1.0]",0.0,0.0,0.0,supplier_stock_node,supplier_stock_node::SDC-VD0949099A,Stock fournisseur SDC-VD0949099A,1.0,0.01,lower_is_riskier,,flat
"[0.01, 0.25, 0.5, 0.75, 0.9, 1.0]",1.0,61148958.3234,,,flat,,1.0,1.0,flat,,"[0.01, 0.25, 0.5, 0.75, 0.9, 1.0]",0.0,0.0,0.0,supplier_stock_node,supplier_stock_node::SDC-VD0951020A,Stock fournisseur SDC-VD0951020A,1.0,0.01,lower_is_riskier,,flat
"[0.01, 0.25, 0.5, 0.75, 0.9, 1.0]",1.0,61148958.3234,,,flat,,1.0,1.0,flat,,"[0.01, 0.25, 0.5, 0.75, 0.9, 1.0]",0.0,0.0,0.0,supplier_stock_node,supplier_stock_node::SDC-VD0956464A,Stock fournisseur SDC-VD0956464A,1.0,0.01,lower_is_riskier,,flat
"[0.01, 0.25, 0.5, 0.75, 0.9, 1.0]",1.0,61148958.3234,,,flat,,1.0,1.0,flat,,"[0.01, 0.25, 0.5, 0.75, 0.9, 1.0]",0.0,0.0,0.0,supplier_stock_node,supplier_stock_node::SDC-VD0960508A,Stock fournisseur SDC-VD0960508A,1.0,0.01,lower_is_riskier,,flat
"[0.01, 0.25, 0.5, 0.75, 0.9, 1.0]",1.0,61148958.3234,,,flat,,1.0,1.0,flat,,"[0.01, 0.25, 0.5, 0.75, 0.9, 1.0]",0.0,0.0,0.0,supplier_stock_node,supplier_stock_node::SDC-VD0964290A,Stock fournisseur SDC-VD0964290A,1.0,0.01,lower_is_riskier,,increasing
"[0.01, 0.25, 0.5, 0.75, 0.9, 1.0]",1.0,61148958.3234,,,flat,,1.0,1.0,flat,,"[0.01, 0.25, 0.5, 0.75, 0.9, 1.0]",0.0,0.0,0.0,supplier_stock_node,supplier_stock_node::SDC-VD0972460A,Stock fournisseur SDC-VD0972460A,1.0,0.01,lower_is_riskier,,flat
"[0.01, 0.25, 0.5, 0.75, 0.9, 1.0]",1.0,61148958.3234,,,flat,,1.0,1.0,flat,,"[0.01, 0.25, 0.5, 0.75, 0.9, 1.0]",0.0,0.0,0.0,supplier_stock_node,supplier_stock_node::SDC-VD0975221A,Stock fournisseur SDC-VD0975221A,1.0,0.01,lower_is_riskier,,flat
"[0.01, 0.25, 0.5, 0.75, 0.9, 1.0]",1.0,61148958.3234,,,flat,,1.0,1.0,flat,,"[0.01, 0.25, 0.5, 0.75, 0.9, 1.0]",0.0,0.0,0.0,supplier_stock_node,supplier_stock_node::SDC-VD0989480A,Stock fournisseur SDC-VD0989480A,1.0,0.01,lower_is_riskier,,flat
"[0.01, 0.25, 0.5, 0.75, 0.9, 1.0]",1.0,61148958.3234,,,flat,,1.0,1.0,flat,,"[0.01, 0.25, 0.5, 0.75, 0.9, 1.0]",0.0,0.0,0.0,supplier_stock_node,supplier_stock_node::SDC-VD0990780A,Stock fournisseur SDC-VD0990780A,1.0,0.01,lower_is_riskier,,flat
"[0.01, 0.25, 0.5, 0.75, 0.9, 1.0]",1.0,61148958.3234,,,flat,,1.0,1.0,flat,,"[0.01, 0.25, 0.5, 0.75, 0.9, 1.0]",0.0,0.0,0.0,supplier_stock_node,supplier_stock_node::SDC-VD0993480A,Stock fournisseur SDC-VD0993480A,1.0,0.01,lower_is_riskier,,flat
"[0.01, 0.25, 0.5, 0.75, 0.9, 1.0]",1.0,61148958.3234,,,flat,,1.0,1.0,flat,,"[0.01, 0.25, 0.5, 0.75, 0.9, 1.0]",0.0,0.0,0.0,supplier_stock_node,supplier_stock_node::SDC-VD1091642A,Stock fournisseur SDC-VD1091642A,1.0,0.01,lower_is_riskier,,flat
"[0.01, 0.25, 0.5, 0.75, 0.9, 1.0]",1.0,61148958.3234,,,flat,,1.0,1.0,flat,,"[0.01, 0.25, 0.5, 0.75, 0.9, 1.0]",0.0,0.0,0.0,supplier_stock_node,supplier_stock_node::SDC-VD1095770A,Stock fournisseur SDC-VD1095770A,1.0,0.01,lower_is_riskier,,flat
"[0.01, 0.25, 0.5, 0.75, 0.9, 1.0]",1.0,61148958.3234,,,flat,,1.0,1.0,flat,,"[0.01, 0.25, 0.5, 0.75, 0.9, 1.0]",0.0,0.0,0.0,supplier_stock_node,supplier_stock_node::SDC-VD1096202A,Stock fournisseur SDC-VD1096202A,1.0,0.01,lower_is_riskier,,flat

etudecas/simulation/sensibility/active_supplier_parameter_result_upstream_constrained/supplier_parameter_sensitivity_report.md

## Strongest External Market Effects

- Delai external market: max external qty delta 437062157.4965, safe band [1.0, 2.0]
- Stock fournisseur global: max external qty delta 23261391.9174, safe band [0.25, 1.0]
- Capacite fournisseur SDC-VD0518684A: max external qty delta 4940663.9138, safe band [0.25, 1.0]
- Capacite fournisseur SDC-VD0910216A: max external qty delta 4407543.7396, safe band [0.25, 1.0]
- Capacite fournisseur SDC-VD0993480A: max external qty delta 4340039.3301, safe band [0.1, 1.0]
- Capacite fournisseur globale: max external qty delta 4024399.2639, safe band [0.01, 1.0]
- Capacite fournisseur SDC-VD0520115A: max external qty delta 1413464.2427, safe band [0.01, 1.0]
- Capacite fournisseur SDC-VD0914320A: max external qty delta 1288281.9224, safe band [0.25, 1.0]
- Capacite fournisseur SDC-VD1095770A: max external qty delta 1187823.2022, safe band [0.01, 1.0]
- Capacite fournisseur SDC-VD0508918A: max external qty delta 1187823.2022, safe band [0.1, 1.0]